{
  "active_generation": "cg1-054db37fba4aa0e8101c87b8207deb2c",
  "cases": [
    {
      "actual": {
        "active_generation": "cg1-6a2c068318f2dc83d6fa17c2a20b49a5",
        "projection_states": {
          "cache": "ready",
          "graph": "ready",
          "landmarks": "ready",
          "lexical": "ready",
          "lookup": "ready",
          "path": "ready",
          "ui": "ready",
          "vector": "ready"
        },
        "repositories": 25
      },
      "diagnostics": [],
      "expected": {
        "projections": [
          "cache",
          "graph",
          "landmarks",
          "lexical",
          "lookup",
          "path",
          "ui"
        ],
        "repositories": 25,
        "staged": 0
      },
      "id": "baseline_activation",
      "status": "pass"
    },
    {
      "actual": {
        "entity_handles": [
          "kb.e1.eyJUIjoiZSIsIkciOiJnMS03MmQ2ODZiNWJiZDdiY2IwNjA1YzU0YjM2Y2M5ZWVmYiIsIkkiOiJlLWJkMTc2NTIxNGIyY2QxMTYyNDgwZWY2OWNiOThiN2E1YzE4NzZmYTE4YjU2YjNkYTc3MjliZWFmM2EzZWI5ZTAifQ",
          "kb.e1.eyJUIjoiZSIsIkciOiJnMS03MmQ2ODZiNWJiZDdiY2IwNjA1YzU0YjM2Y2M5ZWVmYiIsIkkiOiJlLTQ3YzE3NDdiZmNiMDExMWJmZjc3YWIwNDlmMjhhMGI2NThmMmNjMjhmYzYxODE2N2EyMjc3YWQ2MmY0YTFkZGEifQ",
          "kb.e1.eyJUIjoiZSIsIkciOiJnMS03MmQ2ODZiNWJiZDdiY2IwNjA1YzU0YjM2Y2M5ZWVmYiIsIkkiOiJlLWZkN2ZhODk1YWI1MWU4ZDU3YmU4ZjQ4MjUwNmViMzk0NGJhMWNkODUyMjA0N2I0MmRkM2I1MDVlZTI1ZTg0NjIifQ",
          "kb.e1.eyJUIjoiZSIsIkciOiJnMS03MmQ2ODZiNWJiZDdiY2IwNjA1YzU0YjM2Y2M5ZWVmYiIsIkkiOiJlLTFlYmY3ZGJkMGQ4MjYxNjE0OGJmNzU5ZTdmOTE2Nzc3MWUwOWNlNDMxMWU5ODEwZTY1MmZjNjdiYmIzZDFkMDQifQ",
          "kb.e1.eyJUIjoiZSIsIkciOiJnMS03MmQ2ODZiNWJiZDdiY2IwNjA1YzU0YjM2Y2M5ZWVmYiIsIkkiOiJlLTUwZjZjMTA3YTc4ZDUzN2UyMWVmMGQ4ZjljM2NlODQ3YjlhZDkwN2EwN2JjZWExYjcyNmE3MTlhMTgxYTMxNDQifQ"
        ],
        "evidence_ids": [
          "kb.v1.eyJUIjoidiIsIkciOiJnMS03MmQ2ODZiNWJiZDdiY2IwNjA1YzU0YjM2Y2M5ZWVmYiIsIkkiOiJ2LTJlMDc1MzdmMzU5MTkwNGFkYmEwZGI3NWE4MmZmZWQxOWIxMWU4MmFkYTdjOWNmMTNkODFhY2VhYThlYzk4NGQifQ",
          "kb.v1.eyJUIjoidiIsIkciOiJnMS03MmQ2ODZiNWJiZDdiY2IwNjA1YzU0YjM2Y2M5ZWVmYiIsIkkiOiJ2LTMyZjdlNjcyOWUxMDcyNTM2MTNjYjZjNDc2YWIzZWM1NTI2NGU5Y2U5MmE3ZThmNWE0MjdhM2U3YzZiNDZiYjIifQ",
          "kb.v1.eyJUIjoidiIsIkciOiJnMS03MmQ2ODZiNWJiZDdiY2IwNjA1YzU0YjM2Y2M5ZWVmYiIsIkkiOiJ2LTVkNTFjMDIxOWY4MjRhM2E1ZDk1Mzc4NzRjMWIwOTZmMTZlNjQxNjI0ZmJmMWJiZTE5NDE1MjMwNzhiZGUxMzgifQ",
          "kb.v1.eyJUIjoidiIsIkciOiJnMS03MmQ2ODZiNWJiZDdiY2IwNjA1YzU0YjM2Y2M5ZWVmYiIsIkkiOiJ2LTljMTIyMTRkYmQ0NDhjY2MyZmMzZWVlZDhiZmU4NWNmY2U5YTJjMzMxOWQyZDQ0YjBhM2Y1NDYxZGI2MjUxMjgifQ",
          "kb.v1.eyJUIjoidiIsIkciOiJnMS03MmQ2ODZiNWJiZDdiY2IwNjA1YzU0YjM2Y2M5ZWVmYiIsIkkiOiJ2LTljZDdjYmNkYWE2ZjhhOThmYjFmY2U3MjYwM2E2ZTRhYWViOGM3MDY1ZGIwZTdmNWY0MTJmZGY4NDJmNGQ0M2UifQ",
          "kb.v1.eyJUIjoidiIsIkciOiJnMS03MmQ2ODZiNWJiZDdiY2IwNjA1YzU0YjM2Y2M5ZWVmYiIsIkkiOiJ2LWI0ZDhhYWNmNWZiMGIzYmUyMjE1NzFiNTU4ZTgyMmQzNjc4MDIxZjU0OTc4Yzg5YzM0MGYzZjBhZmUwNmJkMzMifQ",
          "kb.v1.eyJUIjoidiIsIkciOiJnMS03MmQ2ODZiNWJiZDdiY2IwNjA1YzU0YjM2Y2M5ZWVmYiIsIkkiOiJ2LWJlNWY3NjZkOTgxYTZmMDFmM2Y0NjMxNmUyMTUzNTNhNDNmMTBkNDRmZTMzODAwNjg5NzY1ZWRhMmFiZjRiMjAifQ",
          "kb.v1.eyJUIjoidiIsIkciOiJnMS03MmQ2ODZiNWJiZDdiY2IwNjA1YzU0YjM2Y2M5ZWVmYiIsIkkiOiJ2LWMwYTE3MmZhYzczYmIxNTJlZWJlY2U2MTgxYmVhN2U4Y2RmNjczNjI3ZGMyYjgxOWU3MGJiOWRlOTFmOTM5YzAifQ",
          "kb.v1.eyJUIjoidiIsIkciOiJnMS03MmQ2ODZiNWJiZDdiY2IwNjA1YzU0YjM2Y2M5ZWVmYiIsIkkiOiJ2LWQ0YTI3Zjk0MjQ5OGE2Y2VjNDViNmZmODhhOTViNmI2OWNlNzZhODY2ODRjYWQwODBiZDhjMzUwOWZkZmU4Y2MifQ"
        ],
        "locations": [
          "src/main/java/example/OrderController.java"
        ],
        "negative_evidence": "",
        "planner_route": [
          "route:exact:selected",
          "route:lexical:selected",
          "route:graph:skipped_intent",
          "route:structural:skipped_prior_result",
          "route:path:skipped_non_path_intent",
          "route:vector:skipped_prior_result"
        ],
        "result_handle": "kb.r1.eyJUIjoiciIsIkciOiJnMS03MmQ2ODZiNWJiZDdiY2IwNjA1YzU0YjM2Y2M5ZWVmYiIsIkkiOiJleUpGYm5ScGRHbGxjeUk2V3lKcllpNWpNUzVsZVVwVlNXcHZhVmw1U1hOSmEyTnBUMmxLYmsxVE1ETk5iVkV5VDBSYWFVNVhTbWxhUkdScFdUSkpkMDVxUVRGWmVsVXdXV3BOTWxreVRUVmFWMVp0V1dsSmMwbHJhMmxQYVVwcVRGUkJOVTVxVW10T2JVbDVXbFJhYkUxRVdtMU9NbGw1VFdwbk5VNXRWWGRQVkZVeFRqSlpNRnBYVW1wYVYxRjVUa2RLYTA1WFRUSk5WRlY1VFcxVk1VOUVhM2xaYWxwdFdsUkdhVTR5V1RSWmVrSnFUbFJqYVdaUklpd2lhMkl1WXpFdVpYbEtWVWxxYjJsWmVVbHpTV3RqYVU5cFNtNU5VekF6VFcxUk1rOUVXbWxPVjBwcFdrUmthVmt5U1hkT2FrRXhXWHBWTUZscVRUSlpNazAxV2xkV2JWbHBTWE5KYTJ0cFQybEtha3hVVm0xYVZFNXRXa1JPYkU1RVl6RlBWRmswV21wSk5VMVVTVFZhVkdNd1RWUk9hRTVVWjNoWlYwVXlUVWRSZUZwRVZUQmFiVkpxVG0xU2JFOUVRVFJOYW1jd1QwZFdhazB5VVhoYVYxa3pUakpOTVUxSFdXbG1VU0lzSW10aUxtTXhMbVY1U2xWSmFtOXBXWGxKYzBsclkybFBhVXB1VFZNd00wMXRVVEpQUkZwcFRsZEthVnBFWkdsWk1rbDNUbXBCTVZsNlZUQlphazB5V1RKTk5WcFhWbTFaYVVselNXdHJhVTlwU21wTVZHTTBXa1JSZWs5VVJUVlpha2sxVFhwWk5FNTZRVE5hUkd4b1RrUldiVTB5VFROWlZHeHJUVWRLYTA5VVRUVk9WRUpwVG1wUk0wOVVaR3hPYlVacFRXcGpNRTR5V1hwT2JWVjZXa2RWZWxwWFRUQlBWMFZwWmxFaUxDSnJZaTVqTVM1bGVVcFZTV3B2YVZsNVNYTkphMk5wVDJsS2JrMVRNRE5OYlZFeVQwUmFhVTVYU21sYVJHUnBXVEpKZDA1cVFURlplbFV3V1dwTk1sa3lUVFZhVjFadFdXbEpjMGxyYTJsUGFVcHFURlJrYlUxRVRUQk9NbGt3V1cxVk1GbFhWVEJaYWxWNlRucEZOVTVFUlhwUFJGVXhUa2RGZVU5RWJHMU9SRlV5V1hwak1FMVVXVEpOUkd4dFdrUmFhazVFVFhsWk1rNW9UWHBDYVU1cVFYZE5WMFY1V21wUmFXWlJJaXdpYTJJdVl6RXVaWGxLVlVscWIybFplVWx6U1d0amFVOXBTbTVOVXpBelRXMVJNazlFV21sT1YwcHBXa1JrYVZreVNYZE9ha0V4V1hwVk1GbHFUVEpaTWswMVdsZFdiVmxwU1hOSmEydHBUMmxLYWt4VWEzZE9WMFY2V2xkTmQxbHFWVEJhUkZVMVdrZFplVTVxUlRGTmFrazBUbXBDYkZsNlRYZGFWRWt4V1dwbmQwNXFaekphVjA1clRUSkpkMDVxV20xYVIwbDNUVmRWTTFwRVpHdFpla2t4V2tSRmVFNHlTV2xtVVNJc0ltdGlMbU14TG1WNVNsVkphbTlwV1hsSmMwbHJZMmxQYVVwdVRWTXdNMDF0VVRKUFJGcHBUbGRLYVZwRVpHbFpNa2wzVG1wQk1WbDZWVEJaYWsweVdUSk5OVnBYVm0xWmFVbHpTV3RyYVU5cFNtcE1WMGw0VGtkYWJFOVVVVEpPZWswelRsUlpOVTVxU1hsWmJVMHpUVmRXYlU1dFZUSlplbWhyV1ZSamVGcFVSVE5OVjA1c1dsUmpNazlYV1RKUFYxcHFUMFJPYkZwVVRURk9NbFpzV1hwQ2JGbDZUWGhQUjFWcFpsRWlMQ0pyWWk1ak1TNWxlVXBWU1dwdmFWbDVTWE5KYTJOcFQybEtiazFUTUROTmJWRXlUMFJhYVU1WFNtbGFSR1JwV1RKSmQwNXFRVEZaZWxVd1dXcE5NbGt5VFRWYVYxWnRXV2xKYzBscmEybFBhVXBxVEZkU2FFNVVVWGRQUjFVMFRXcEJlVTB5VFRCUFZFNXFUbnBOZWs5SFJYZFpWMDVyV2xSYWFrMTZhM2hPTWxWNFQxZE9hMXBxVlRWWlZHUm9XbGRhYkUxRWFHdFpiVVpxVG0xYWFrOVVWbWxPUkVrd1RVZEphV1pSSWl3aWEySXVZekV1WlhsS1ZVbHFiMmxaZVVselNXdGphVTlwU201TlV6QXpUVzFSTWs5RVdtbE9WMHBwV2tSa2FWa3lTWGRPYWtFeFdYcFZNRmxxVFRKWk1rMDFXbGRXYlZscFNYTkphMnRwVDJsS2FreFhVbWxOYWs1clRYcG5NRTVIUlRSUFZFa3dUbFJSTlUxWFZtbE9iVnBxV1ZkV2ExbDZUWGRPZWxsM1RUSlJlRTFYUlRCTk1rWnJXWHBDYlZsVVpHaGFhbU15V2tSWk1FNVhTbWhaZWxreFdXMVNiRnB0VFdsbVVTSXNJbXRpTG1VeExtVjVTbFZKYW05cFdsTkpjMGxyWTJsUGFVcHVUVk13TTAxdFVUSlBSRnBwVGxkS2FWcEVaR2xaTWtsM1RtcEJNVmw2VlRCWmFrMHlXVEpOTlZwWFZtMVphVWx6U1d0cmFVOXBTbXhNVkVac1dXMVpNMXBIU210TlIxRTBUV3BaZUU1cVJUQlBSMHB0VG5wVk5WcFVaRzFQVkVVeVRucGpNMDFYVlhkUFYwNXNUa1JOZUUxWFZUVlBSRVYzV2xSWk1VMXRXbXBPYW1ScFdXMUplbHBFUm10TlJGRnBabEVpTENKcllpNWxNUzVsZVVwVlNXcHZhVnBUU1hOSmEyTnBUMmxLYmsxVE1ETk5iVkV5VDBSYWFVNVhTbWxhUkdScFdUSkpkMDVxUVRGWmVsVXdXV3BOTWxreVRUVmFWMVp0V1dsSmMwbHJhMmxQYVVwc1RGUlJNMWw2UlROT1JHUnBXbTFPYVUxRVJYaE5WMHB0V21wak0xbFhTWGRPUkd4dFRXcG9hRTFIU1RKT1ZHaHRUVzFPYWsxcWFHMVplbGw0VDBSRk1rNHlSWGxOYW1NeldWZFJNazF0V1RCWlZFWnJXa2RGYVdaUklpd2lhMkl1WlRFdVpYbEtWVWxxYjJsYVUwbHpTV3RqYVU5cFNtNU5VekF6VFcxUk1rOUVXbWxPVjBwcFdrUmthVmt5U1hkT2FrRXhXWHBWTUZscVRUSlpNazAxV2xkV2JWbHBTWE5KYTJ0cFQybEtiRXhVVlhkYWFscHFUVlJCTTFsVVl6UmFSRlY2VGpKVmVVMVhWbTFOUjFFMFdtcHNhazB5VG14UFJGRXpXV3BzYUZwRWEzZE9Na1YzVGpKS2FscFhSWGhaYW1ONVRtMUZNMDFVYkdoTlZHZDRXVlJOZUU1RVVXbG1VU0lzSW10aUxtVXhMbVY1U2xWSmFtOXBXbE5KYzBsclkybFBhVXB1VFZNd00wMXRVVEpQUkZwcFRsZEthVnBFWkdsWk1rbDNUbXBCTVZsNlZUQlphazB5V1RKTk5WcFhWbTFaYVVselNXdHJhVTlwU214TVYwcHJUVlJqTWs1VVNYaE9SMGw1V1RKUmVFMVVXWGxPUkdkM1dsZFpNazlYVG1sUFZHaHBUakpGTVZsNlJUUk9lbHB0V1ZSRk5GbHFWVEpaYWs1cldWUmpNMDFxYkdsYVYwWnRUVEpGZWxwWFNUVmFWRUZwWmxFaUxDSnJZaTVsTVM1bGVVcFZTV3B2YVZwVFNYTkphMk5wVDJsS2JrMVRNRE5OYlZFeVQwUmFhVTVYU21sYVJHUnBXVEpKZDA1cVFURlplbFV3V1dwTk1sa3lUVFZhVjFadFdXbEpjMGxyYTJsUGFVcHNURmRhYTA0eVdtaFBSR3N4V1ZkSk1VMVhWVFJhUkZVeldXMVZORnBxVVRSTmFsVjNUbTFXYVUxNmF6Qk9SMHBvVFZkT2EwOUVWWGxOYWtFd1RqSkpNRTF0VW10Tk1ra3hUVVJXYkZwVVNURmFWR2N3VG1wSmFXWlJJaXdpYTJJdWRqRXVaWGxLVlVscWIybGthVWx6U1d0amFVOXBTbTVOVXpBelRXMVJNazlFV21sT1YwcHBXa1JrYVZreVNYZE9ha0V4V1hwVk1GbHFUVEpaTWswMVdsZFdiVmxwU1hOSmEydHBUMmxLTWt4VVNteE5SR014VFhwa2JVMTZWVFZOVkd0M1RrZEdhMWx0UlhkYVIwa3pUbGRGTkUxdFdtMWFWMUY0VDFkSmVFMVhWVFJOYlVacldWUmthazlYVG0xTlZFNXJUMFJHYUZreVZtaFpWR2hzV1hwck5FNUhVV2xtVVNJc0ltdGlMbll4TG1WNVNsVkphbTlwWkdsSmMwbHJZMmxQYVVwdVRWTXdNMDF0VVRKUFJGcHBUbGRLYVZwRVpHbFpNa2wzVG1wQk1WbDZWVEJaYWsweVdUSk5OVnBYVm0xWmFVbHpTV3RyYVU5cFNqSk1WRTE1V21wa2JFNXFZM2xQVjFWNFRVUmplVTVVVFRKTlZFNXFXV3BhYWs1RVl6SlpWMGw2V2xkTk1VNVVTVEpPUjFVMVdUSlZOVTF0UlROYVZHaHRUbGRGTUUxcVpHaE5NbFV6V1hwYWFVNUVXbWxaYWtscFpsRWlMQ0pyWWk1Mk1TNWxlVXBWU1dwdmFXUnBTWE5KYTJOcFQybEtiazFUTUROTmJWRXlUMFJhYVU1WFNtbGFSR1JwV1RKSmQwNXFRVEZaZWxVd1dXcE5NbGt5VFRWYVYxWnRXV2xKYzBscmEybFBhVW95VEZSV2EwNVVSbXBOUkVsNFQxZFpORTFxVW1oTk1rVXhXa1JyTVUxNll6Uk9lbEpxVFZkSmQwOVVXbTFOVkZwc1RtcFJlRTVxU1RCYWJVcHRUVmRLYVZwVVJUVk9SRVV4VFdwTmQwNTZhR2xhUjFWNFRYcG5hV1pSSWl3aWEySXVkakV1WlhsS1ZVbHFiMmxrYVVselNXdGphVTlwU201TlV6QXpUVzFSTWs5RVdtbE9WMHBwV2tSa2FWa3lTWGRPYWtFeFdYcFZNRmxxVFRKWk1rMDFXbGRXYlZscFNYTkphMnRwVDJsS01reFViR3BOVkVsNVRWUlNhMWx0VVRCT1JHaHFXVEpOZVZwdFRYcGFWMVpzV2tSb2FWcHRWVFJPVjA1dFdUSlZOVmxVU21wTmVrMTRUMWRSZVZwRVVUQlpha0pvVFRKWk1VNUVXWGhhUjBreVRXcFZlRTFxWjJsbVVTSXNJbXRpTG5ZeExtVjVTbFZKYW05cFpHbEpjMGxyWTJsUGFVcHVUVk13TTAxdFVUSlBSRnBwVGxkS2FWcEVaR2xaTWtsM1RtcEJNVmw2VlRCWmFrMHlXVEpOTlZwWFZtMVphVWx6U1d0cmFVOXBTakpNVkd4cVdrUmthbGx0VG10WlYwVXlXbXBvYUU5VWFHMVpha1p0V1RKVk0wMXFXWGROTWtVeVdsUlNhRmxYVm1sUFIwMHpUVVJaTVZwSFNYZGFWR1J0VGxkWk1FMVVTbTFhUjFrMFRrUktiVTVIVVRCTk1sVnBabEVpTENKcllpNTJNUzVsZVVwVlNXcHZhV1JwU1hOSmEyTnBUMmxLYmsxVE1ETk5iVkV5VDBSYWFVNVhTbWxhUkdScFdUSkpkMDVxUVRGWmVsVXdXV3BOTWxreVRUVmFWMVp0V1dsSmMwbHJhMmxQYVVveVRGZEpNRnBFYUdoWlYwNXRUbGRhYVUxSFNYcFpiVlY1VFdwRk1VNTZSbWxPVkZVMFdsUm5lVTF0VVhwT2FtTTBUVVJKZUZwcVZUQlBWR00wV1hwbk5WbDZUVEJOUjFsNldtcENhRnB0VlhkT2JVcHJUWHBOYVdaUklpd2lhMkl1ZGpFdVpYbEtWVWxxYjJsa